{
  "schema": "bcp.capability_grant/1",
  "grant_id": "GRANT-MEDR-P2-20261005",
  "capability_pattern": "med-rebuild.*",
  "max_permission_class": "P2_PROJECT_MUTATION",
  "scope": {
    "project_ids": [
      "med-rebuild"
    ],
    "path_roots": [],
    "service_names": [],
    "package_ids": []
  },
  "issued_at": "2026-10-05T17:41:00+01:00",
  "expires_at": null,
  "revocable": true,
  "status": "ACTIVE",
  "fresh_approval_required_for_p4": true
}
